{
  "format": "fog-of-sea-lattice-adoption-requirements-v1",
  "registerId": "FOS-LAT",
  "version": "1.1.0",
  "scope": {
    "authorized": [
      "Selected in-game Field Guide explanations",
      "Post-resolution turn and outcome learning copy",
      "Selected Academy comparison, Sources & Scope, and first-phase decision-method copy",
      "Advisory lint of Academy curriculum data"
    ],
    "excluded": [
      "Safety, privacy, persistence, accessibility, contact-disclosure, score, and control instructions whose exact operative meaning must remain primary",
      "Player-authored text",
      "Runtime execution of the Lattice engine or profile",
      "Product-wide copy conversion while prose still participates in game logic"
    ],
    "broadAdoptionStatus": "blocked",
    "statement": "This register authorizes one bounded, owner-compiled static-copy slice. It does not establish full-product Lattice adoption or semantic, domain, accessibility, or human approval."
  },
  "provenance": [
    {
      "id": "PROV-001",
      "kind": "user-directive",
      "locator": "Conversation directive: Update FOG OF SEA to utilize Lattice in in-game and Academy copy",
      "revision": "2026-09-01",
      "role": "Authorizes the bounded adoption objective"
    },
    {
      "id": "PROV-002",
      "kind": "repository",
      "locator": "howardhayden/lattice commit 029ca14570b3ebe5703f504ab4b4baed90883f84",
      "revision": "engine 0.1.1; relational-systems profile v1.1.0; profile digest d28c72daeda482e6fce5f976894181751391ecd819e84c026ea1d4ce9879a468; derived owner-package digest 68c04a2870951fc7a1e08c17d949b7f60db3010f0c683b4b0534dd3ea325828b",
      "role": "Pins the owner-side compiler inputs"
    },
    {
      "id": "PROV-003",
      "kind": "repository",
      "locator": "howardhayden/fogofsea commit 70907a77cba735c151e52929dd5a56d795c3d04f",
      "revision": "bounded-adoption baseline",
      "role": "Identifies the implementation state from which the copy inventory was derived"
    },
    {
      "id": "PROV-004",
      "kind": "implementation-audit",
      "locator": "docs/red-team/2026-09-01-lattice-copy-pass.md",
      "revision": "2.0.0",
      "role": "Records adversarial findings, corrections, and evidence limits"
    },
    {
      "id": "PROV-005",
      "kind": "project-policy",
      "locator": "ACCESSIBILITY.md; SECURITY.md; docs/design/11-TRACEABILITY.md",
      "revision": "current bounded-adoption worktree",
      "role": "Supplies accessibility, trust-boundary, and evidence constraints"
    },
    {
      "id": "PROV-006",
      "kind": "user-directive",
      "locator": "Conversation directives: atomize Academy guidance, apply progressive disclosure, use the latest howardhayden/lattice release, and provide non-answer-giving support for every first-phase question",
      "revision": "2026-09-22",
      "role": "Requires the latest pinned Academy copy pipeline and non-answer-giving first-phase decision support while leaving disclosure behavior and presentation to the host interface"
    }
  ],
  "requirements": [
    {
      "id": "FOS-LAT-ARC-001",
      "title": "Pinned owner-side compilation",
      "statement": "Lattice copy must be compiled only in the owner workflow with engine 0.1.1, relational-systems profile v1.1.0, profile digest d28c72daeda482e6fce5f976894181751391ecd819e84c026ea1d4ce9879a468, and derived owner-package digest 68c04a2870951fc7a1e08c17d949b7f60db3010f0c683b4b0534dd3ea325828b.",
      "provenanceIds": ["PROV-001", "PROV-002", "PROV-006"],
      "priority": "mandatory",
      "precedence": 1,
      "dependencies": [],
      "conflicts": ["Runtime or unpinned Lattice transformation"],
      "owners": ["scripts/compile-lattice-copy.mjs", "authoring/lattice-copy.requests.json"],
      "acceptanceCriteria": [{"id": "FOS-LAT-ARC-001-AC-01", "assertion": "Compilation derives the owner-package digest from the pinned clean checkout's closed execution manifest before and after realization, and fails when any engine, profile, commit, file digest, or derived pin differs."}],
      "tests": [
        {"id": "FOS-LAT-ARC-001-T-P01", "kind": "positive", "assertion": "The exact pins compile in the owner workflow.", "evidence": "Owner-side compiler test"},
        {"id": "FOS-LAT-ARC-001-T-N01", "kind": "negative", "assertion": "A mutated profile or owner digest is rejected.", "evidence": "Red-team pin mutation"},
        {"id": "FOS-LAT-ARC-001-T-B01", "kind": "boundary", "assertion": "A semantically equivalent but differently versioned profile is not silently accepted.", "evidence": "Exact-version assertion"}
      ],
      "evidenceMethods": ["static-analysis", "unit-test", "red-team-mutation"],
      "status": "implemented",
      "supersedes": [],
      "supersession": null
    },
    {
      "id": "FOS-LAT-SEM-001",
      "title": "Invariant meaning",
      "statement": "Every adopted output must preserve its declared facts, actions, states, causal relationships, limits, uncertainty, consequences, and recovery path without adding unsupported claims.",
      "provenanceIds": ["PROV-001", "PROV-002", "PROV-005"],
      "priority": "mandatory",
      "precedence": 2,
      "dependencies": ["FOS-LAT-ARC-001"],
      "conflicts": ["Register fit or ornament overriding semantic fidelity"],
      "owners": ["authoring/lattice-copy.requests.json", "scripts/verify-lattice-copy.mts"],
      "acceptanceCriteria": [{"id": "FOS-LAT-SEM-001-AC-01", "assertion": "Each output satisfies every required semantic assertion and no prohibited assertion."}],
      "tests": [
        {"id": "FOS-LAT-SEM-001-T-P01", "kind": "positive", "assertion": "Required atoms remain present in selected copy.", "evidence": "Generated-output assertion test"},
        {"id": "FOS-LAT-SEM-001-T-N01", "kind": "negative", "assertion": "Mechanics, causality, or uncertainty drift is rejected.", "evidence": "Forbidden-claim mutation"},
        {"id": "FOS-LAT-SEM-001-T-B01", "kind": "boundary", "assertion": "A stylistically strong candidate missing one invariant is rejected.", "evidence": "Single-atom deletion test"}
      ],
      "evidenceMethods": ["static-analysis", "unit-test", "red-team-mutation"],
      "status": "implemented",
      "supersedes": [],
      "supersession": null
    },
    {
      "id": "FOS-LAT-LAY-001",
      "title": "Explicit route and layer",
      "statement": "Every transformed surface must declare an independently testable layer, form, register, and pressure route; a mixed surface may not inherit one route for all meanings.",
      "provenanceIds": ["PROV-001", "PROV-002", "PROV-004"],
      "priority": "mandatory",
      "precedence": 3,
      "dependencies": ["FOS-LAT-SEM-001"],
      "conflicts": ["One undifferentiated voice pass over mixed operative and interpretive copy"],
      "owners": ["requirements/lattice-copy-inventory.json", "authoring/lattice-copy.requests.json"],
      "acceptanceCriteria": [{"id": "FOS-LAT-LAY-001-AC-01", "assertion": "The copy inventory contains the exact debrief, Field Guide, and Academy route splits."}],
      "tests": [
        {"id": "FOS-LAT-LAY-001-T-P01", "kind": "positive", "assertion": "All adopted outputs resolve to declared inventory routes.", "evidence": "Bidirectional inventory test"},
        {"id": "FOS-LAT-LAY-001-T-N01", "kind": "negative", "assertion": "A request referencing an unknown or incompatible route fails.", "evidence": "Route-reference mutation"},
        {"id": "FOS-LAT-LAY-001-T-B01", "kind": "boundary", "assertion": "A two-layer Field Guide request retains both independently declared routes.", "evidence": "Paired-target assertion"}
      ],
      "evidenceMethods": ["schema-validation", "unit-test", "red-team-mutation"],
      "status": "implemented",
      "supersedes": [],
      "supersession": null
    },
    {
      "id": "FOS-LAT-SEM-002",
      "title": "Operative clarity has priority",
      "statement": "Operative text must state the exact action, state, consequence, scope, or recovery without relying on imagery, implication, color, sound, or spatial inference.",
      "provenanceIds": ["PROV-002", "PROV-005"],
      "priority": "mandatory",
      "precedence": 1,
      "dependencies": ["FOS-LAT-SEM-001", "FOS-LAT-LAY-001"],
      "conflicts": ["Atmosphere obscuring action or trust-boundary meaning"],
      "owners": ["app/latticeCopy.ts", "app/page.tsx", "app/Academy.tsx", "app/kriegsspiel.ts"],
      "acceptanceCriteria": [{"id": "FOS-LAT-SEM-002-AC-01", "assertion": "Operative outputs remain immediately understandable when read without surrounding visual context."}],
      "tests": [
        {"id": "FOS-LAT-SEM-002-T-P01", "kind": "positive", "assertion": "Actions and model boundaries are stated directly.", "evidence": "Required-phrase assertions"},
        {"id": "FOS-LAT-SEM-002-T-N01", "kind": "negative", "assertion": "An implication-only instruction is prohibited.", "evidence": "Adversarial candidate test"},
        {"id": "FOS-LAT-SEM-002-T-B01", "kind": "boundary", "assertion": "Interpretive companion text cannot weaken the paired operative statement.", "evidence": "Paired-route comparison"}
      ],
      "evidenceMethods": ["static-analysis", "unit-test", "manual-review-not-claimed"],
      "status": "implemented",
      "supersedes": [],
      "supersession": null
    },
    {
      "id": "FOS-LAT-DOM-001",
      "title": "Evidence-bounded learning",
      "statement": "Turn and outcome learning copy must distinguish recorded diagnostic evidence, committed matrix failure, absence of a tracked finding, and absence of causal proof; score alone must not manufacture blame or exoneration.",
      "provenanceIds": ["PROV-003", "PROV-004"],
      "priority": "mandatory",
      "precedence": 1,
      "dependencies": ["FOS-LAT-SEM-001"],
      "conflicts": ["No clear mistake claims based on incomplete diagnostics", "Strongest-cause ranking without a ranking rule"],